{
  "approvedSourceRevision": "1111111111111111111111111111111111111111",
  "approvedVersion": "wiki-v1.0.0",
  "candidateSourceRevision": "2222222222222222222222222222222222222222",
  "candidateVersion": "v3.4.17-candidate",
  "diagnostics": [],
  "diffVersion": "1.0.0",
  "domains": [
    {
      "added": [
        {
          "blocking": false,
          "changeId": "change_monster_sanct_hellslave_added",
          "changeType": "added",
          "domain": "monster",
          "entityId": "sanct_hellslave",
          "entityType": "monster",
          "evidence": [],
          "fieldChanges": [],
          "notes": [],
          "reviewStatus": "auto_verified"
        }
      ],
      "approvedCount": 8,
      "candidateCount": 8,
      "conflicts": [
        {
          "blocking": true,
          "changeId": "change_monster_legacy_monster_name_hellslave_conflict",
          "changeType": "conflict",
          "domain": "monster",
          "entityId": "legacy_monster_name_hellslave",
          "entityType": "monster",
          "evidence": [],
          "fieldChanges": [],
          "notes": [
            "Multiple formal targets exist; no target was selected automatically."
          ],
          "reviewStatus": "blocked"
        }
      ],
      "domain": "monster",
      "entityType": "monster",
      "modified": [
        {
          "blocking": false,
          "changeId": "change_monster_monster_boss_modified",
          "changeType": "modified",
          "domain": "monster",
          "entityId": "monster_boss",
          "entityType": "monster",
          "evidence": [],
          "fieldChanges": [
            {
              "approvedValue": false,
              "candidateValue": true,
              "category": "canonical",
              "path": "/boss"
            }
          ],
          "notes": [],
          "reviewStatus": "review_required"
        },
        {
          "blocking": false,
          "changeId": "change_monster_monster_display_display_only",
          "changeType": "display_only",
          "domain": "monster",
          "entityId": "monster_display",
          "entityType": "monster",
          "evidence": [],
          "fieldChanges": [
            {
              "approvedValue": "Old Label",
              "candidateValue": "New Label",
              "category": "display",
              "path": "/displayName"
            }
          ],
          "notes": [],
          "reviewStatus": "review_required"
        },
        {
          "blocking": false,
          "changeId": "change_monster_monster_drop_relation_changed",
          "changeType": "relation_changed",
          "domain": "monster",
          "entityId": "monster_drop",
          "entityType": "monster",
          "evidence": [],
          "fieldChanges": [
            {
              "approvedValue": "drop_old",
              "candidateValue": "drop_new",
              "category": "relation",
              "path": "/dropTableRef/entityId"
            }
          ],
          "notes": [],
          "reviewStatus": "review_required"
        },
        {
          "blocking": false,
          "changeId": "change_monster_monster_hp_modified",
          "changeType": "modified",
          "domain": "monster",
          "entityId": "monster_hp",
          "entityType": "monster",
          "evidence": [],
          "fieldChanges": [
            {
              "approvedValue": 300,
              "candidateValue": 350,
              "category": "canonical",
              "path": "/hp"
            }
          ],
          "notes": [],
          "reviewStatus": "review_required"
        },
        {
          "blocking": false,
          "changeId": "change_monster_monster_map_relation_changed",
          "changeType": "relation_changed",
          "domain": "monster",
          "entityId": "monster_map",
          "entityType": "monster",
          "evidence": [],
          "fieldChanges": [
            {
              "approvedValue": {
                "entityId": "map_a",
                "entityType": "map"
              },
              "candidateValue": {
                "state": "missing"
              },
              "category": "relation",
              "path": "/mapRef/ref:map:map_a"
            },
            {
              "approvedValue": {
                "state": "missing"
              },
              "candidateValue": {
                "entityId": "map_b",
                "entityType": "map"
              },
              "category": "relation",
              "path": "/mapRef/ref:map:map_b"
            }
          ],
          "notes": [],
          "reviewStatus": "review_required"
        }
      ],
      "removed": [
        {
          "blocking": false,
          "changeId": "change_monster_monster_removed_removed",
          "changeType": "removed",
          "domain": "monster",
          "entityId": "monster_removed",
          "entityType": "monster",
          "evidence": [],
          "fieldChanges": [],
          "notes": [
            "Removal requires coverage and source-scope review before publication."
          ],
          "reviewStatus": "review_required"
        }
      ],
      "technicalOnly": [
        {
          "blocking": false,
          "changeId": "change_monster_de_train_hellslave_technical_only",
          "changeType": "technical_only",
          "domain": "monster",
          "entityId": "de_train_hellslave",
          "entityType": "monster",
          "evidence": [
            "approved#mobs.de_train_hellslave",
            "candidate#mobs.de_train_hellslave"
          ],
          "fieldChanges": [
            {
              "approvedValue": "approved#mobs.de_train_hellslave",
              "candidateValue": "candidate#mobs.de_train_hellslave",
              "category": "verification",
              "path": "/verification/source"
            },
            {
              "approvedValue": "1111111111111111111111111111111111111111",
              "candidateValue": "2222222222222222222222222222222222222222",
              "category": "verification",
              "path": "/version/sourceRevision"
            }
          ],
          "notes": [],
          "reviewStatus": "auto_verified"
        },
        {
          "blocking": false,
          "changeId": "change_monster_monster_provenance_technical_only",
          "changeType": "technical_only",
          "domain": "monster",
          "entityId": "monster_provenance",
          "entityType": "monster",
          "evidence": [
            "approved#monster_provenance",
            "candidate#monster_provenance"
          ],
          "fieldChanges": [
            {
              "approvedValue": "approved#monster_provenance",
              "candidateValue": "candidate#monster_provenance",
              "category": "verification",
              "path": "/verification/source"
            },
            {
              "approvedValue": "1111111111111111111111111111111111111111",
              "candidateValue": "2222222222222222222222222222222222222222",
              "category": "verification",
              "path": "/version/sourceRevision"
            }
          ],
          "notes": [],
          "reviewStatus": "auto_verified"
        }
      ],
      "unchangedCount": 0,
      "unresolvedAdded": [],
      "unresolvedResolved": []
    },
    {
      "added": [
        {
          "blocking": false,
          "changeId": "change_map_map_new_added",
          "changeType": "added",
          "domain": "map",
          "entityId": "map_new",
          "entityType": "map",
          "evidence": [],
          "fieldChanges": [],
          "notes": [],
          "reviewStatus": "auto_verified"
        }
      ],
      "approvedCount": 2,
      "candidateCount": 2,
      "conflicts": [],
      "domain": "map",
      "entityType": "map",
      "modified": [
        {
          "blocking": false,
          "changeId": "change_map_map_a_modified",
          "changeType": "modified",
          "domain": "map",
          "entityId": "map_a",
          "entityType": "map",
          "evidence": [
            "approved#map_a",
            "candidate#map_a"
          ],
          "fieldChanges": [
            {
              "approvedValue": "Old Map Label",
              "candidateValue": "New Map Label",
              "category": "display",
              "path": "/displayName"
            },
            {
              "approvedValue": {
                "state": "missing"
              },
              "candidateValue": {
                "entityId": "sanct_hellslave",
                "entityType": "monster"
              },
              "category": "relation",
              "path": "/monsterRefs/ref:monster:sanct_hellslave"
            },
            {
              "approvedValue": "approved#map_a",
              "candidateValue": "candidate#map_a",
              "category": "verification",
              "path": "/verification/source"
            }
          ],
          "notes": [],
          "reviewStatus": "review_required"
        }
      ],
      "removed": [
        {
          "blocking": false,
          "changeId": "change_map_map_removed_removed",
          "changeType": "removed",
          "domain": "map",
          "entityId": "map_removed",
          "entityType": "map",
          "evidence": [],
          "fieldChanges": [],
          "notes": [
            "Removal requires coverage and source-scope review before publication."
          ],
          "reviewStatus": "review_required"
        }
      ],
      "technicalOnly": [],
      "unchangedCount": 0,
      "unresolvedAdded": [],
      "unresolvedResolved": []
    },
    {
      "added": [
        {
          "blocking": false,
          "changeId": "change_drop_drop_new_added",
          "changeType": "added",
          "domain": "drop",
          "entityId": "drop_new",
          "entityType": "dropTable",
          "evidence": [],